Which of these situations can increase the reaction time of a driver?, An icy road, Worn tyres on his car, Stopping for a cup of coffee, Driving for a long time without taking a break,3
An electron collides with a neutral atom and ionizes it. Which of the following describes the particles present after the collision?, An electron and an excited atom, An excited atom containing an excess electron, Two electrons and a positive ion. , Two electrons and a positive ion. , 2
Artificial radioactive nuclides are made radioactive in the reactor as a consequence of bombardment by, alpha particles, beta particles, protons, neutrons, 3
A doctor with a PhD is a doctor of what?, Philosophy, Psychology, Phrenology, Physical Therapy,0
What is isobutylphenylpropanoic acid more commonly known as?, Ibuprofen, Morphine, Ketamine, Aspirin,0
In a photoelectric experiment Increasing the intensity of the illumination at the surface leads to an increase in the, work function, B minimum frequency at which electrons are emitted, current through the photocell, speed of the electrons,2
Which of these is a stop codon in DNA?, TAA, ACT, ACA, GTA,0